{
  "actions_analyzed": 6,
  "correction_plans": [
    {
      "action_id": "move_test_detect_layer_violations_none_to_src/010_cluster_008.rs",
      "confidence": 1.0,
      "correction_strategies": [
        {
          "function": "test_detect_layer_violations_none",
          "target_layer": "010_cluster_008.rs",
          "type": "MoveToLayer"
        },
        {
          "function": "test_detect_layer_violations_none",
          "target_layer": "010_cluster_008.rs",
          "type": "EnsureImports"
        }
      ],
      "estimated_fix_time_seconds": 15,
      "predicted_violations": [
        {
          "affected_files": [
            "src/010_cluster_008.rs"
          ],
          "confidence": 1.0,
          "severity": "High",
          "type": "LayerViolation"
        }
      ],
      "rollback_criteria": {
        "mandatory": [
          "BuildFailed",
          "InvariantViolated { invariant_ids: [\"layer_ordering\"] }"
        ],
        "suggested": [
          "QualityDecreased { threshold: 0.05 }",
          "TestsFailed { critical_tests: [] }"
        ]
      },
      "tier": "Moderate",
      "verification_policy": {
        "estimated_time_seconds": 60,
        "incremental_eligible": false,
        "required_checks": [
          {
            "type": "CargoCheck"
          },
          {
            "filter": null,
            "type": "CargoTest"
          }
        ],
        "scope": {
          "module": "src/010_cluster_008.rs",
          "transitive_depth": 2,
          "type": "ModuleLocal"
        }
      }
    },
    {
      "action_id": "move_test_check_move_allowed_to_src/010_refactor_constraints.rs",
      "confidence": 1.0,
      "correction_strategies": [
        {
          "function": "test_check_move_allowed",
          "target_layer": "010_refactor_constraints.rs",
          "type": "MoveToLayer"
        },
        {
          "function": "test_check_move_allowed",
          "target_layer": "010_refactor_constraints.rs",
          "type": "EnsureImports"
        }
      ],
      "estimated_fix_time_seconds": 15,
      "predicted_violations": [
        {
          "affected_files": [
            "src/010_refactor_constraints.rs"
          ],
          "confidence": 1.0,
          "severity": "High",
          "type": "LayerViolation"
        }
      ],
      "rollback_criteria": {
        "mandatory": [
          "BuildFailed",
          "InvariantViolated { invariant_ids: [\"layer_ordering\"] }"
        ],
        "suggested": [
          "QualityDecreased { threshold: 0.05 }",
          "TestsFailed { critical_tests: [] }"
        ]
      },
      "tier": "Moderate",
      "verification_policy": {
        "estimated_time_seconds": 60,
        "incremental_eligible": false,
        "required_checks": [
          {
            "type": "CargoCheck"
          },
          {
            "filter": null,
            "type": "CargoTest"
          }
        ],
        "scope": {
          "module": "src/010_refactor_constraints.rs",
          "transitive_depth": 2,
          "type": "ModuleLocal"
        }
      }
    },
    {
      "action_id": "move_test_conscience_blocks_invalid_move_to_src/082_conscience_graph.rs",
      "confidence": 1.0,
      "correction_strategies": [
        {
          "function": "test_conscience_blocks_invalid_move",
          "target_layer": "082_conscience_graph.rs",
          "type": "MoveToLayer"
        },
        {
          "function": "test_conscience_blocks_invalid_move",
          "target_layer": "082_conscience_graph.rs",
          "type": "EnsureImports"
        }
      ],
      "estimated_fix_time_seconds": 15,
      "predicted_violations": [
        {
          "affected_files": [
            "src/082_conscience_graph.rs"
          ],
          "confidence": 1.0,
          "severity": "High",
          "type": "LayerViolation"
        }
      ],
      "rollback_criteria": {
        "mandatory": [
          "BuildFailed",
          "InvariantViolated { invariant_ids: [\"layer_ordering\"] }"
        ],
        "suggested": [
          "QualityDecreased { threshold: 0.05 }",
          "TestsFailed { critical_tests: [] }"
        ]
      },
      "tier": "Moderate",
      "verification_policy": {
        "estimated_time_seconds": 60,
        "incremental_eligible": false,
        "required_checks": [
          {
            "type": "CargoCheck"
          },
          {
            "filter": null,
            "type": "CargoTest"
          }
        ],
        "scope": {
          "module": "src/082_conscience_graph.rs",
          "transitive_depth": 2,
          "type": "ModuleLocal"
        }
      }
    },
    {
      "action_id": "move_test_conscience_allows_valid_action_to_src/082_conscience_graph.rs",
      "confidence": 1.0,
      "correction_strategies": [
        {
          "function": "test_conscience_allows_valid_action",
          "target_layer": "082_conscience_graph.rs",
          "type": "MoveToLayer"
        },
        {
          "function": "test_conscience_allows_valid_action",
          "target_layer": "082_conscience_graph.rs",
          "type": "EnsureImports"
        }
      ],
      "estimated_fix_time_seconds": 15,
      "predicted_violations": [
        {
          "affected_files": [
            "src/082_conscience_graph.rs"
          ],
          "confidence": 1.0,
          "severity": "High",
          "type": "LayerViolation"
        }
      ],
      "rollback_criteria": {
        "mandatory": [
          "BuildFailed",
          "InvariantViolated { invariant_ids: [\"layer_ordering\"] }"
        ],
        "suggested": [
          "QualityDecreased { threshold: 0.05 }",
          "TestsFailed { critical_tests: [] }"
        ]
      },
      "tier": "Moderate",
      "verification_policy": {
        "estimated_time_seconds": 60,
        "incremental_eligible": false,
        "required_checks": [
          {
            "type": "CargoCheck"
          },
          {
            "filter": null,
            "type": "CargoTest"
          }
        ],
        "scope": {
          "module": "src/082_conscience_graph.rs",
          "transitive_depth": 2,
          "type": "ModuleLocal"
        }
      }
    },
    {
      "action_id": "move_test_query_allowed_actions_to_src/082_conscience_graph.rs",
      "confidence": 1.0,
      "correction_strategies": [
        {
          "function": "test_query_allowed_actions",
          "target_layer": "082_conscience_graph.rs",
          "type": "MoveToLayer"
        },
        {
          "function": "test_query_allowed_actions",
          "target_layer": "082_conscience_graph.rs",
          "type": "EnsureImports"
        }
      ],
      "estimated_fix_time_seconds": 15,
      "predicted_violations": [
        {
          "affected_files": [
            "src/082_conscience_graph.rs"
          ],
          "confidence": 1.0,
          "severity": "High",
          "type": "LayerViolation"
        }
      ],
      "rollback_criteria": {
        "mandatory": [
          "BuildFailed",
          "InvariantViolated { invariant_ids: [\"layer_ordering\"] }"
        ],
        "suggested": [
          "QualityDecreased { threshold: 0.05 }",
          "TestsFailed { critical_tests: [] }"
        ]
      },
      "tier": "Moderate",
      "verification_policy": {
        "estimated_time_seconds": 60,
        "incremental_eligible": false,
        "required_checks": [
          {
            "type": "CargoCheck"
          },
          {
            "filter": null,
            "type": "CargoTest"
          }
        ],
        "scope": {
          "module": "src/082_conscience_graph.rs",
          "transitive_depth": 2,
          "type": "ModuleLocal"
        }
      }
    },
    {
      "action_id": "move_collect_refactor_actions_to_src/010_cluster_008.rs",
      "confidence": 1.0,
      "correction_strategies": [
        {
          "function": "collect_refactor_actions",
          "target_layer": "010_cluster_008.rs",
          "type": "MoveToLayer"
        },
        {
          "function": "collect_refactor_actions",
          "target_layer": "010_cluster_008.rs",
          "type": "EnsureImports"
        }
      ],
      "estimated_fix_time_seconds": 15,
      "predicted_violations": [
        {
          "affected_files": [
            "src/010_cluster_008.rs"
          ],
          "confidence": 1.0,
          "severity": "High",
          "type": "LayerViolation"
        }
      ],
      "rollback_criteria": {
        "mandatory": [
          "BuildFailed",
          "InvariantViolated { invariant_ids: [\"layer_ordering\"] }"
        ],
        "suggested": [
          "QualityDecreased { threshold: 0.05 }",
          "TestsFailed { critical_tests: [] }"
        ]
      },
      "tier": "Moderate",
      "verification_policy": {
        "estimated_time_seconds": 60,
        "incremental_eligible": false,
        "required_checks": [
          {
            "type": "CargoCheck"
          },
          {
            "filter": null,
            "type": "CargoTest"
          }
        ],
        "scope": {
          "module": "src/010_cluster_008.rs",
          "transitive_depth": 2,
          "type": "ModuleLocal"
        }
      }
    }
  ],
  "project_root": "/home/cicero-arch-omen/ai_sandbox/codex-agent/codex_sse/server-tools/MMSB/tools/mmsb-analyzer",
  "quality_deltas": [
    {
      "acceptable": true,
      "action_id": "rename_file_/home/cicero-arch-omen/ai_sandbox/codex-agent/codex_sse/server-tools/MMSB/tools/mmsb-analyzer/src/010_invariant_types.rs_to_/home/cicero-arch-omen/ai_sandbox/codex-agent/codex_sse/server-tools/MMSB/tools/mmsb-analyzer/src/020_invariant_types.rs",
      "cohesion_delta": 0.0,
      "complexity_delta": 0.0,
      "overall_score_delta": 0.0,
      "reason": "Quality improved or maintained",
      "violation_delta": 0
    },
    {
      "acceptable": true,